file,key,claim_name,claim_n,verdict,aact_brief_title,aact_enrollment,title_overlap,n_ratio,country_mismatch,notes
CBD_SEIZURE_REVIEW.html,NCT02224690,GWPCARE2,132,TITLE_MISMATCH,A Study to Investigate the Efficacy and Safety of Cannabidiol (GWP42003-P; CBD) ,171,0,0.77,,title 0-token overlap (claim='GWPCARE2' aact='A Study to Investigate the Efficacy and ')
CBD_SEIZURE_REVIEW.html,NCT02224560,GWPCARE3,149,TITLE_MISMATCH,Efficacy and Safety of GWP42003-P for Seizures Associated With Lennox-Gastaut Sy,225,0,0.66,,title 0-token overlap (claim='GWPCARE3' aact='Efficacy and Safety of GWP42003-P for Se')
CBD_SEIZURE_REVIEW.html,NCT02224703,GWPCARE4,171,TITLE_MISMATCH,GWPCARE2 A Study to Investigate the Efficacy and Safety of Cannabidiol (GWP42003,199,0,0.86,,title 0-token overlap (claim='GWPCARE4' aact='GWPCARE2 A Study to Investigate the Effi')
CD_BIOLOGICS_NMA_REVIEW.html,LEGACY-PRENCT-ACCENT-1,ACCENT-1,573,ISRCTN_ONLY,,,,,,non-AACT key
CD_BIOLOGICS_NMA_REVIEW.html,LEGACY-PRENCT-CLASSIC-1,CLASSIC-1,148,ISRCTN_ONLY,,,,,,non-AACT key
CD_BIOLOGICS_NMA_REVIEW.html,NCT00152490,PRECiSE-1,662,TITLE_MISMATCH,A Study to Test the Effect of CDP870 in the Treatment of Crohn's Disease Over 26,604,0,1.10,,title 0-token overlap (claim='PRECiSE-1' aact='A Study to Test the Effect of CDP870 in ')
CD_BIOLOGICS_NMA_REVIEW.html,NCT01224171,GEMINI-2,368,TITLE_MISMATCH,Study of Vedolizumab in Patients With Moderate to Severe Crohn's Disease,416,0,0.88,,title 0-token overlap (claim='GEMINI-2' aact='Study of Vedolizumab in Patients With Mo')
CD_BIOLOGICS_NMA_REVIEW.html,NCT01369329,UNITI-1,496,OK,A Study to Evaluate the Safety and Efficacy of Ustekinumab in Patients With Mode,769,1,0.64,,
CD_BIOLOGICS_NMA_REVIEW.html,NCT03105128,ADVANCE,547,TITLE_MISMATCH,A Study of the Efficacy and Safety of Risankizumab in Participants With Moderate,931,0,0.59,,title 0-token overlap (claim='ADVANCE' aact='A Study of the Efficacy and Safety of Ri')
CD_BIOLOGICS_NMA_REVIEW.html,NCT03345849,U-EXCEL,483,TITLE_MISMATCH,A Study of the Efficacy and Safety of Upadacitinib in Participants With Moderate,526,0,0.92,,title 0-token overlap (claim='U-EXCEL' aact='A Study of the Efficacy and Safety of Up')
CDK46_MBC_REVIEW.html,NCT01740427,PALOMA-2,666,OK,A Study of Palbociclib (PD-0332991) + Letrozole vs. Letrozole For 1st Line Treat,666,1,1.00,,
CDK46_MBC_REVIEW.html,NCT01958021,MONALEESA-2,668,TITLE_MISMATCH,Study of Efficacy and Safety of LEE011 in Postmenopausal Women With Advanced Bre,668,0,1.00,,title 0-token overlap (claim='MONALEESA-2' aact='Study of Efficacy and Safety of LEE011 i')
CDK46_MBC_REVIEW.html,NCT02246621,MONARCH-3,493,TITLE_MISMATCH,A Study of Nonsteroidal Aromatase Inhibitors Plus Abemaciclib (LY2835219) in Pos,493,0,1.00,,title 0-token overlap (claim='MONARCH-3' aact='A Study of Nonsteroidal Aromatase Inhibi')
CFTR_MODULATORS_NMA_REVIEW.html,NCT01807923,TRAFFIC,553,TITLE_MISMATCH,A Study of Lumacaftor in Combination With Ivacaftor in Cystic Fibrosis Subjects ,559,0,0.99,,title 0-token overlap (claim='TRAFFIC' aact='A Study of Lumacaftor in Combination Wit')
CFTR_MODULATORS_NMA_REVIEW.html,NCT02347657,EVOLVE,499,TITLE_MISMATCH,"A Randomized, Double-Blind, Placebo-Controlled, Parallel-Group Study to Evaluate",510,0,0.98,,"title 0-token overlap (claim='EVOLVE' aact='A Randomized, Double-Blind, Placebo-Cont')"
CFTR_MODULATORS_NMA_REVIEW.html,NCT03525444,VX18-445-102,403,TITLE_MISMATCH,A Phase 3 Study of VX-445 Combination Therapy in Subjects With Cystic Fibrosis H,405,0,1.00,,title 0-token overlap (claim='VX18-445-102' aact='A Phase 3 Study of VX-445 Combination Th')
CGRP_MIGRAINE_NMA_REVIEW.html,NCT02456740,STRIVE,635,TITLE_MISMATCH,Study to Evaluate the Efficacy and Safety of Erenumab (AMG 334) in Migraine Prev,955,0,0.66,,title 0-token overlap (claim='STRIVE' aact='Study to Evaluate the Efficacy and Safet')
CGRP_MIGRAINE_NMA_REVIEW.html,NCT02629861,HALO-EM,584,TITLE_MISMATCH,Efficacy and Safety of 2 Dose Regimens of TEV-48125 Versus Placebo for the Preve,875,0,0.67,,title 0-token overlap (claim='HALO-EM' aact='Efficacy and Safety of 2 Dose Regimens o')
CGRP_MIGRAINE_NMA_REVIEW.html,NCT02614183,EVOLVE-1,638,OK,Evaluation of Galcanezumab in the Prevention of Episodic Migraine- the EVOLVE-1 ,862,1,0.74,,
CGRP_MIGRAINE_NMA_REVIEW.html,NCT02559895,PROMISE-1,444,TITLE_MISMATCH,A Multicenter Assessment of ALD403 in Frequent Episodic Migraine,898,0,0.49,,title 0-token overlap (claim='PROMISE-1' aact='A Multicenter Assessment of ALD403 in Fr')
CHOLERA_OCV_REVIEW.html,NCT02027207,Single-Dose Shanchol Bangladesh,204438,OK,"Single Dose Oral Cholera Vaccine Study in Dhaka, Bangladesh",204438,3,1.00,,
COLCHICINE_CVD_REVIEW.html,NCT02551094,COLCOT,4745,OK,Colchicine Cardiovascular Outcomes Trial (COLCOT),4745,1,1.00,,
COLCHICINE_CVD_REVIEW.html,NCT03048825,CLEAR SYNERGY,7062,OK,Colchicine and Spironolactone in Patients with MI / SYNERGY Stent Registry,7264,1,0.97,,
COLCHICINE_CVD_REVIEW.html,NCT02898610,CONVINCE,3144,OK,Colchicine for Prevention of Vascular Inflammation in Non-cardio Embolic Stroke,3154,1,1.00,,
COPD_TRIPLE_REVIEW.html,NCT02164513,IMPACT,8285,TITLE_MISMATCH,"A Study Comparing the Efficacy, Safety and Tolerability of Fixed Dose Combinatio",10355,0,0.80,,"title 0-token overlap (claim='IMPACT' aact='A Study Comparing the Efficacy, Safety a')"
COPD_TRIPLE_REVIEW.html,NCT02465567,ETHOS,4257,OK,Study to Assess the Efficacy and Safety of PT010 Relative to PT003 and PT009 in ,8588,1,0.50,,
COPD_TRIPLE_REVIEW.html,NCT02497001,KRONOS,1264,OK,"A Randomized, Double-Blind, Parallel-Group, 24-Week, Chronic-Dosing, Multi-Cente",1902,1,0.66,,
COVID_ORAL_ANTIVIRALS_REVIEW.html,NCT04960202,EPIC-HR,1379,OK,EPIC-HR: Study of Oral PF-07321332/Ritonavir Compared With Placebo in Nonhospita,2091,1,0.66,,
COVID_ORAL_ANTIVIRALS_REVIEW.html,NCT04575597,MOVe-OUT,1408,TITLE_MISMATCH,Efficacy and Safety of Molnupiravir (MK-4482) in Non-Hospitalized Adult Particip,1735,0,0.81,,title 0-token overlap (claim='MOVe-OUT' aact='Efficacy and Safety of Molnupiravir (MK-')
CRYPTOCOCCAL_MENINGITIS_AFRICA_NMA_REVIEW.html,LEGACY-ISRCTN-45035509-ACTA,ACTA (Molloy 2018),665,ISRCTN_ONLY,,,,,,non-AACT key
CRYPTOCOCCAL_MENINGITIS_AFRICA_NMA_REVIEW.html,LEGACY-ISRCTN-72509687-AMBITION-CM,AMBITION-cm (Jarvis 2022),814,ISRCTN_ONLY,,,,,,non-AACT key
CRYPTOCOCCAL_MENINGITIS_AFRICA_NMA_REVIEW.html,NCT01075152,COAT (ART timing in CM),177,OK,Cryptococcal Optimal ART Timing Trial,177,1,1.00,,
DOAC_AF_NMA_REVIEW.html,NCT00262600,RE-LY,12098,TITLE_MISMATCH,Randomized Evaluation of Long Term Anticoagulant Therapy (RE-LY) With Dabigatran,18113,0,0.67,,title 0-token overlap (claim='RE-LY' aact='Randomized Evaluation of Long Term Antic')
DOAC_AF_NMA_REVIEW.html,NCT00403767,ROCKET-AF,14171,TITLE_MISMATCH,An Efficacy and Safety Study of Rivaroxaban With Warfarin for the Prevention of ,14269,0,0.99,,title 0-token overlap (claim='ROCKET-AF' aact='An Efficacy and Safety Study of Rivaroxa')
DOAC_AF_NMA_REVIEW.html,NCT00412984,ARISTOTLE,18201,TITLE_MISMATCH,Apixaban for the Prevention of Stroke in Subjects With Atrial Fibrillation,20976,0,0.87,,title 0-token overlap (claim='ARISTOTLE' aact='Apixaban for the Prevention of Stroke in')
DOAC_AF_NMA_REVIEW.html,NCT00781391,ENGAGE-AF-TIMI-48,14071,OK,Global Study to Assess the Safety and Effectiveness of Edoxaban (DU-176b) vs Sta,21105,2,0.67,,
DOAC_AF_REVIEW.html,NCT00262600,RE-LY,12098,TITLE_MISMATCH,Randomized Evaluation of Long Term Anticoagulant Therapy (RE-LY) With Dabigatran,18113,0,0.67,,title 0-token overlap (claim='RE-LY' aact='Randomized Evaluation of Long Term Antic')
DOAC_AF_REVIEW.html,NCT00403767,ROCKET-AF,14171,TITLE_MISMATCH,An Efficacy and Safety Study of Rivaroxaban With Warfarin for the Prevention of ,14269,0,0.99,,title 0-token overlap (claim='ROCKET-AF' aact='An Efficacy and Safety Study of Rivaroxa')
DOAC_AF_REVIEW.html,NCT00412984,ARISTOTLE,18201,TITLE_MISMATCH,Apixaban for the Prevention of Stroke in Subjects With Atrial Fibrillation,20976,0,0.87,,title 0-token overlap (claim='ARISTOTLE' aact='Apixaban for the Prevention of Stroke in')
DOAC_AF_REVIEW.html,NCT00781391,ENGAGE AF-TIMI 48,14071,OK,Global Study to Assess the Safety and Effectiveness of Edoxaban (DU-176b) vs Sta,21105,2,0.67,,
DOAC_VTE_NMA_REVIEW.html,NCT00291330,RE-COVER,2539,TITLE_MISMATCH,Efficacy and Safety of Dabigatran Compared to Warfarin for 6 Month Treatment of ,2564,0,0.99,,title 0-token overlap (claim='RE-COVER' aact='Efficacy and Safety of Dabigatran Compar')
DOAC_VTE_NMA_REVIEW.html,NCT00440193,EINSTEIN-DVT,3449,OK,Oral Direct Factor Xa Inhibitor Rivaroxaban in Patients With Acute Symptomatic D,3449,1,1.00,,
DOAC_VTE_NMA_REVIEW.html,NCT00643201,AMPLIFY,5395,TITLE_MISMATCH,Efficacy and Safety Study of Apixaban for the Treatment of Deep Vein Thrombosis ,5614,0,0.96,,title 0-token overlap (claim='AMPLIFY' aact='Efficacy and Safety Study of Apixaban fo')
DOAC_VTE_NMA_REVIEW.html,NCT00986154,HOKUSAI-VTE,8240,OK,Comparative Investigation of Low Molecular Weight (LMW) Heparin/Edoxaban Tosylat,8292,1,0.99,,
DOLUTEGRAVIR_ART_SSA_REVIEW.html,NCT03122262,ADVANCE,702,OK,ADVANCE Study of DTG + TAF + FTC vs DTG + TDF + FTC and EFV + TDF+FTC in First-l,1110,1,0.63,,
DOLUTEGRAVIR_ART_SSA_REVIEW.html,NCT02777229,NAMSAL,613,TITLE_MISMATCH,Efficacy and Safety of a Dolutegravir-based Regimen for the Initial Management o,616,0,1.00,,title 0-token overlap (claim='NAMSAL' aact='Efficacy and Safety of a Dolutegravir-ba')
DOLUTEGRAVIR_ART_SSA_REVIEW.html,NCT03048422,IMPAACT 2010,428,TITLE_MISMATCH,Evaluating the Efficacy and Safety of Dolutegravir-Containing Versus Efavirenz-C,643,0,0.67,,title 0-token overlap (claim='IMPAACT 2010' aact='Evaluating the Efficacy and Safety of Do')
DONANEMAB_AD_SOLO_REVIEW.html,NCT04437511,TRAILBLAZER-ALZ 2,1736,OK,A Study of Donanemab (LY3002813) in Participants With Early Alzheimer's Disease ,1736,1,1.00,,
DORAVIRINE_HIV_REVIEW.html,NCT02403674,DRIVE-AHEAD,728,TITLE_MISMATCH,"Comparison of Doravirine, Tenofovir, Lamivudine (MK-1439A) and ATRIPLA™ in Treat",734,0,0.99,,"title 0-token overlap (claim='DRIVE-AHEAD' aact='Comparison of Doravirine, Tenofovir, Lam')"
DORAVIRINE_HIV_REVIEW.html,NCT02275780,DRIVE-FORWARD,766,TITLE_MISMATCH,Safety and Efficacy of Doravirine (MK-1439) in Participants With Human Immunodef,769,0,1.00,,title 0-token overlap (claim='DRIVE-FORWARD' aact='Safety and Efficacy of Doravirine (MK-14')
DORAVIRINE_HIV_REVIEW.html,NCT02397096,DRIVE-SHIFT,670,TITLE_MISMATCH,"Safety and Efficacy of a Switch to Doravirine, Tenofovir, Lamivudine (MK-1439A) ",673,0,1.00,,title 0-token overlap (claim='DRIVE-SHIFT' aact='Safety and Efficacy of a Switch to Dorav')
DUPILUMAB_AD_REVIEW.html,NCT02277743,SOLO-1,448,TITLE_MISMATCH,Study of Dupilumab Monotherapy Administered to Adult Patients With Moderate-to-S,671,0,0.67,,title 0-token overlap (claim='SOLO-1' aact='Study of Dupilumab Monotherapy Administe')
DUPILUMAB_AD_REVIEW.html,NCT02277769,SOLO-2,469,TITLE_MISMATCH,Study of Dupilumab (REGN668/SAR231893) Monotherapy Administered to Adult Patient,708,0,0.66,,title 0-token overlap (claim='SOLO-2' aact='Study of Dupilumab (REGN668/SAR231893) M')
DUPILUMAB_AD_REVIEW.html,NCT02260986,CHRONOS,634,TITLE_MISMATCH,Study to Assess the Efficacy and Long-term Safety of Dupilumab (REGN668/SAR23189,740,0,0.86,,title 0-token overlap (claim='CHRONOS' aact='Study to Assess the Efficacy and Long-te')
DUPILUMAB_COPD_REVIEW.html,NCT03930732,BOREAS,939,TITLE_MISMATCH,"Pivotal Study to Assess the Efficacy, Safety and Tolerability of Dupilumab in Pa",939,0,1.00,,"title 0-token overlap (claim='BOREAS' aact='Pivotal Study to Assess the Efficacy, Sa')"
DUPILUMAB_COPD_REVIEW.html,NCT04456673,NOTUS,935,TITLE_MISMATCH,"Pivotal Study to Assess the Efficacy, Safety and Tolerability of Dupilumab in Pa",935,0,1.00,,"title 0-token overlap (claim='NOTUS' aact='Pivotal Study to Assess the Efficacy, Sa')"
EBOLA_VACCINE_REVIEW.html,NCT02378753,STRIVE Sierra Leone (rVSV\u0394G-ZEBOV),8651,OK,STRIVE (Sierra Leone Trial to Introduce a Vaccine Against Ebola),8651,5,1.00,,
EBOLA_VACCINE_REVIEW.html,LEGACY-PACTR-EBOLA-CI-RING,Ebola ça Suffit Guinea Ring (Henao-Restrepo 2017),4160,ISRCTN_ONLY,,,,,,non-AACT key
EFGARTIGIMOD_MG_REVIEW.html,NCT03669588,ADAPT,167,TITLE_MISMATCH,An Efficacy and Safety Study of ARGX-113 in Patients With Myasthenia Gravis Who ,167,0,1.00,,title 0-token overlap (claim='ADAPT' aact='An Efficacy and Safety Study of ARGX-113')
ELACESTRANT_BC_REVIEW.html,NCT03778931,EMERALD,478,TITLE_MISMATCH,Phase 3 Trial of Elacestrant Versus Standard of Care for the Treatment of ER+/HE,478,0,1.00,,title 0-token overlap (claim='EMERALD' aact='Phase 3 Trial of Elacestrant Versus Stan')
ENSIFENTRINE_COPD_REVIEW.html,NCT04535986,ENHANCE-1,760,TITLE_MISMATCH,A Phase 3 Clinical Trial to Evaluate the Safety and Efficacy of Ensifentrine in ,763,0,1.00,,title 0-token overlap (claim='ENHANCE-1' aact='A Phase 3 Clinical Trial to Evaluate the')
ENSIFENTRINE_COPD_REVIEW.html,NCT04542057,ENHANCE-2,789,TITLE_MISMATCH,A Phase 3 Trial to Evaluate the Safety and Efficacy of Ensifentrine in Patients ,790,0,1.00,,title 0-token overlap (claim='ENHANCE-2' aact='A Phase 3 Trial to Evaluate the Safety a')
ETRASIMOD_UC_REVIEW.html,NCT03945188,ELEVATE UC 52,433,TITLE_MISMATCH,Etrasimod Versus Placebo for the Treatment of Moderately to Severely Active Ulce,433,0,1.00,,title 0-token overlap (claim='ELEVATE UC 52' aact='Etrasimod Versus Placebo for the Treatme')
ETRASIMOD_UC_REVIEW.html,NCT03996369,ELEVATE UC 12,354,TITLE_MISMATCH,Etrasimod Versus Placebo as Induction Therapy in Moderately to Severely Active U,354,0,1.00,,title 0-token overlap (claim='ELEVATE UC 12' aact='Etrasimod Versus Placebo as Induction Th')
EVT_BASILAR_REVIEW.html,NCT04751708,ATTENTION,340,TITLE_MISMATCH,Endovascular Treatment for Acute Basilar Artery Occlusion,340,0,1.00,,title 0-token overlap (claim='ATTENTION' aact='Endovascular Treatment for Acute Basilar')
EVT_BASILAR_REVIEW.html,NCT02737189,BAOCHE,217,TITLE_MISMATCH,Basilar Artery Occlusion Chinese Endovascular Trial,217,0,1.00,,title 0-token overlap (claim='BAOCHE' aact='Basilar Artery Occlusion Chinese Endovas')
EVT_BASILAR_REVIEW.html,NCT01717755,BASICS,300,TITLE_MISMATCH,Basilar Artery International Cooperation Study,282,0,1.06,,title 0-token overlap (claim='BASICS' aact='Basilar Artery International Cooperation')
EVT_EXTENDED_WINDOW_REVIEW.html,NCT02142283,DAWN,206,OK,Clinical Mismatch in the Triage of Wake Up and Late Presenting Strokes Undergoin,206,1,1.00,,
EVT_EXTENDED_WINDOW_REVIEW.html,NCT02586415,DEFUSE 3,207,TITLE_MISMATCH,Endovascular Therapy Following Imaging Evaluation for Ischemic Stroke 3,182,0,1.14,,title 0-token overlap (claim='DEFUSE 3' aact='Endovascular Therapy Following Imaging E')
EVT_EXTENDED_WINDOW_REVIEW.html,NCT03098355,MR CLEAN-LATE,502,TITLE_MISMATCH,Interleukin-2 Following 4SCAR19/22 T Cells Targeting Refractory and/or Recurrent,,0,,,title 0-token overlap (claim='MR CLEAN-LATE' aact='Interleukin-2 Following 4SCAR19/22 T Cel')
EVT_LARGECORE_REVIEW.html,NCT03702413,RESCUE-Japan LIMIT,202,OK,Randomized Controlled Trial of Endovascular Therapy for Acute Large Vessel Occlu,203,3,1.00,,
EVT_LARGECORE_REVIEW.html,NCT04551664,ANGEL-ASPECT,455,OK,Study of Endovascular Therapy in Acute Anterior Circulation Large Vessel Occlusi,456,2,1.00,,
EVT_LARGECORE_REVIEW.html,NCT03876457,SELECT2,350,OK,SELECT2: A Randomized Controlled Trial to Optimize Patient's Selection for Endov,352,1,0.99,,
EVT_LARGECORE_REVIEW.html,NCT03094715,TENSION,253,TITLE_MISMATCH,Efficacy and Safety of Thrombectomy in Stroke With Extended Lesion and Extended ,253,0,1.00,,title 0-token overlap (claim='TENSION' aact='Efficacy and Safety of Thrombectomy in S')
EVT_LARGECORE_REVIEW.html,NCT03811769,LASTE,333,TITLE_MISMATCH,Large Stroke Therapy Evaluation,335,0,0.99,,title 0-token overlap (claim='LASTE' aact='Large Stroke Therapy Evaluation')
EVT_LARGECORE_REVIEW.html,NCT03805308,TESLA,300,OK,The TESLA Trial: Thrombectomy for Emergent Salvage of Large Anterior Circulation,300,1,1.00,,
FENFLURAMINE_SEIZURE_REVIEW.html,NCT02682927,Study 1 (Dravet),80,OK,A Trial of Two Fixed Doses of ZX008 (Fenfluramine HCl) in Children and Young Adu,262,1,0.31,,
FENFLURAMINE_SEIZURE_REVIEW.html,NCT02826863,Study 2 (Dravet+stiripentol),87,AACT_NOT_FOUND,,,,,,NCT not in AACT 2026-04-12 — likely wrong NCT
FENFLURAMINE_SEIZURE_REVIEW.html,NCT03355209,LGS Study 1,174,TITLE_MISMATCH,A Study to Investigate the Efficacy and Safety of ZX008 (Fenfluramine Hydrochlor,296,0,0.59,,title 0-token overlap (claim='LGS Study 1' aact='A Study to Investigate the Efficacy and ')
FINERENONE_REVIEW.html,NCT02540993,FIDELIO-DKD,5674,TITLE_MISMATCH,Efficacy and Safety of Finerenone in Subjects With Type 2 Diabetes Mellitus and ,5734,0,0.99,,title 0-token overlap (claim='FIDELIO-DKD' aact='Efficacy and Safety of Finerenone in Sub')
FINERENONE_REVIEW.html,NCT02545049,FIGARO-DKD,7352,TITLE_MISMATCH,Efficacy and Safety of Finerenone in Subjects With Type 2 Diabetes Mellitus and ,7352,0,1.00,,title 0-token overlap (claim='FIGARO-DKD' aact='Efficacy and Safety of Finerenone in Sub')
FINERENONE_REVIEW.html,NCT04435626,FINEARTS-HF,6001,TITLE_MISMATCH,Study to Evaluate the Efficacy (Effect on Disease) and Safety of Finerenone in P,6016,0,1.00,,title 0-token overlap (claim='FINEARTS-HF' aact='Study to Evaluate the Efficacy (Effect o')
FINERENONE_REVIEW.html,NCT01874431,ARTS-DN,821,TITLE_MISMATCH,Safety and Efficacy of Different Oral Doses of BAY94-8862 in Subjects With Type ,823,0,1.00,,title 0-token overlap (claim='ARTS-DN' aact='Safety and Efficacy of Different Oral Do')
FRAGILITY_FRACTURE_NMA_REVIEW.html,NCT01631214,ARCH,4093,TITLE_MISMATCH,Study to Determine the Efficacy and Safety of Romosozumab in the Treatment of Po,4093,0,1.00,,title 0-token overlap (claim='ARCH' aact='Study to Determine the Efficacy and Safe')
FRAGILITY_FRACTURE_NMA_REVIEW.html,NCT01575834,FRAME,7180,TITLE_MISMATCH,Efficacy and Safety of Romosozumab Treatment in Postmenopausal Women With Osteop,7180,0,1.00,,title 0-token overlap (claim='FRAME' aact='Efficacy and Safety of Romosozumab Treat')
FRAGILITY_FRACTURE_NMA_REVIEW.html,NCT00321620,ACTIVE,1645,TITLE_MISMATCH,Study of Denosumab vs. Zoledronic Acid to Treat Bone Metastases in Men With Horm,1904,0,0.86,,title 0-token overlap (claim='ACTIVE' aact='Study of Denosumab vs. Zoledronic Acid t')
FRAGILITY_FRACTURE_NMA_REVIEW.html,NCT00089791,FREEDOM,7808,OK,A Study to Evaluate Denosumab in the Treatment of Postmenopausal Osteoporosis,7808,1,1.00,,
FRAGILITY_FRACTURE_NMA_REVIEW.html,LEGACY-VERT-1999,VERT,388,ISRCTN_ONLY,,,,,,non-AACT key
GLP1_CVOT_NMA_REVIEW.html,NCT01179048,LEADER,9340,TITLE_MISMATCH,Liraglutide Effect and Action in Diabetes: Evaluation of Cardiovascular Outcome ,9341,0,1.00,,title 0-token overlap (claim='LEADER' aact='Liraglutide Effect and Action in Diabete')
GLP1_CVOT_NMA_REVIEW.html,NCT01720446,SUSTAIN-6,3297,OK,Trial to Evaluate Cardiovascular and Other Long-term Outcomes With Semaglutide i,3297,1,1.00,,
GLP1_CVOT_NMA_REVIEW.html,NCT01394952,REWIND,9901,OK,Researching Cardiovascular Events With a Weekly Incretin in Diabetes (REWIND),9901,1,1.00,,
GLP1_CVOT_NMA_REVIEW.html,NCT02692716,PIONEER-6,3183,TITLE_MISMATCH,A Trial Investigating the Cardiovascular Safety of Oral Semaglutide in Subjects ,3183,0,1.00,,title 0-token overlap (claim='PIONEER-6' aact='A Trial Investigating the Cardiovascular')
GLP1_CVOT_NMA_REVIEW.html,NCT01147250,ELIXA,6068,TITLE_MISMATCH,Evaluation of Cardiovascular Outcomes in Patients With Type 2 Diabetes After Acu,6068,0,1.00,,title 0-token overlap (claim='ELIXA' aact='Evaluation of Cardiovascular Outcomes in')
GLP1_CVOT_NMA_REVIEW.html,NCT02465515,HARMONY-Outcomes,9463,TITLE_MISMATCH,"Effect of Albiglutide, When Added to Standard Blood Glucose Lowering Therapies, ",9463,0,1.00,,"title 0-token overlap (claim='HARMONY-Outcomes' aact='Effect of Albiglutide, When Added to Sta')"
GLP1_CVOT_NMA_REVIEW.html,NCT01144338,EXSCEL,14752,OK,Exenatide Study of Cardiovascular Event Lowering Trial (EXSCEL): A Trial To Eval,14752,1,1.00,,
GLP1_CVOT_NMA_REVIEW.html,NCT03496298,AMPLITUDE-O,4076,TITLE_MISMATCH,Effect of Efpeglenatide on Cardiovascular Outcomes,4076,0,1.00,,title 0-token overlap (claim='AMPLITUDE-O' aact='Effect of Efpeglenatide on Cardiovascula')
GLP1_CVOT_REVIEW.html,NCT01147250,ELIXA,6068,TITLE_MISMATCH,Evaluation of Cardiovascular Outcomes in Patients With Type 2 Diabetes After Acu,6068,0,1.00,,title 0-token overlap (claim='ELIXA' aact='Evaluation of Cardiovascular Outcomes in')
GLP1_CVOT_REVIEW.html,NCT01179048,LEADER,9340,TITLE_MISMATCH,Liraglutide Effect and Action in Diabetes: Evaluation of Cardiovascular Outcome ,9341,0,1.00,,title 0-token overlap (claim='LEADER' aact='Liraglutide Effect and Action in Diabete')
GLP1_CVOT_REVIEW.html,NCT01720446,SUSTAIN-6,3297,OK,Trial to Evaluate Cardiovascular and Other Long-term Outcomes With Semaglutide i,3297,1,1.00,,
GLP1_CVOT_REVIEW.html,NCT01144338,EXSCEL,14752,OK,Exenatide Study of Cardiovascular Event Lowering Trial (EXSCEL): A Trial To Eval,14752,1,1.00,,
GLP1_CVOT_REVIEW.html,NCT02465515,HARMONY Outcomes,9463,TITLE_MISMATCH,"Effect of Albiglutide, When Added to Standard Blood Glucose Lowering Therapies, ",9463,0,1.00,,"title 0-token overlap (claim='HARMONY Outcomes' aact='Effect of Albiglutide, When Added to Sta')"
GLP1_CVOT_REVIEW.html,NCT01394952,REWIND,9901,OK,Researching Cardiovascular Events With a Weekly Incretin in Diabetes (REWIND),9901,1,1.00,,
GLP1_CVOT_REVIEW.html,NCT02692716,PIONEER 6,3183,TITLE_MISMATCH,A Trial Investigating the Cardiovascular Safety of Oral Semaglutide in Subjects ,3183,0,1.00,,title 0-token overlap (claim='PIONEER 6' aact='A Trial Investigating the Cardiovascular')
GLP1_CVOT_REVIEW.html,NCT03574597,SELECT,17604,OK,Semaglutide Effects on Heart Disease and Stroke in Patients With Overweight or O,17604,1,1.00,,
GLP1_CVOT_REVIEW.html,NCT03496298,AMPLITUDE-O,4076,TITLE_MISMATCH,Effect of Efpeglenatide on Cardiovascular Outcomes,4076,0,1.00,,title 0-token overlap (claim='AMPLITUDE-O' aact='Effect of Efpeglenatide on Cardiovascula')
GLP1_CVOT_REVIEW.html,NCT03914326,SOUL,9650,TITLE_MISMATCH,A Heart Disease Study of Semaglutide in Patients With Type 2 Diabetes,9651,0,1.00,,title 0-token overlap (claim='SOUL' aact='A Heart Disease Study of Semaglutide in ')
GLP1_MASH_NMA_REVIEW.html,NCT04822181,ESSENCE,1067,TITLE_MISMATCH,Research Study on Whether Semaglutide Works in People With Non-alcoholic Steatoh,1205,0,0.89,,title 0-token overlap (claim='ESSENCE' aact='Research Study on Whether Semaglutide Wo')
GLP1_MASH_NMA_REVIEW.html,NCT04166773,SYNERGY-NASH,129,OK,A Study of Tirzepatide (LY3298176) in Participants With Nonalcoholic Steatohepat,190,1,0.68,,
GLP1_MASH_NMA_REVIEW.html,NCT02970942,Newsome NAFLD,160,TITLE_MISMATCH,Investigation of Efficacy and Safety of Three Dose Levels of Subcutaneous Semagl,320,0,0.50,,title 0-token overlap (claim='Newsome NAFLD' aact='Investigation of Efficacy and Safety of ')
HCC_1L_NMA_REVIEW.html,NCT03434379,IMbrave150,501,TITLE_MISMATCH,A Study of Atezolizumab in Combination With Bevacizumab Compared With Sorafenib ,558,0,0.90,,title 0-token overlap (claim='IMbrave150' aact='A Study of Atezolizumab in Combination W')
HCC_1L_NMA_REVIEW.html,NCT03298451,HIMALAYA,782,TITLE_MISMATCH,Study of Durvalumab and Tremelimumab as First-line Treatment in Patients With Ad,1324,0,0.59,,title 0-token overlap (claim='HIMALAYA' aact='Study of Durvalumab and Tremelimumab as ')
HCC_1L_NMA_REVIEW.html,NCT04039607,CheckMate 9DW,668,TITLE_MISMATCH,A Study of Nivolumab in Combination With Ipilimumab in Participants With Advance,732,0,0.91,,title 0-token overlap (claim='CheckMate 9DW' aact='A Study of Nivolumab in Combination With')
HCC_1L_NMA_REVIEW.html,NCT03713593,LEAP-002,794,OK,Safety and Efficacy of Lenvatinib (E7080/MK-7902) in Combination With Pembrolizu,794,1,1.00,,
HEPATITIS_B_TAF_TDF_REVIEW.html,NCT01940341,"GS-US-320-0108 (TAF vs TDF, HBeAg-negative)",425,OK,Study to Compare Tenofovir Alafenamide (TAF) Versus Tenofovir Disoproxil Fumarat,426,2,1.00,,
HEPATITIS_B_TAF_TDF_REVIEW.html,NCT01940471,"GS-US-320-0110 (TAF vs TDF, HBeAg-positive)",873,OK,Study to Compare Tenofovir Alafenamide (TAF) Versus Tenofovir Disoproxil Fumarat,875,2,1.00,,
HEPATITIS_HCV_DAA_NMA_REVIEW.html,NCT02201940,ASTRAL-1,740,TITLE_MISMATCH,Sofosbuvir/Velpatasvir Fixed Dose Combination for 12 Weeks in Adults With Chroni,741,0,1.00,,title 0-token overlap (claim='ASTRAL-1' aact='Sofosbuvir/Velpatasvir Fixed Dose Combin')
HEPATITIS_HCV_DAA_NMA_REVIEW.html,NCT02201953,ASTRAL-3,552,TITLE_MISMATCH,Comparison of Sofosbuvir/Velpatasvir Fixed Dose Combination for 12 Weeks With So,558,0,0.99,,title 0-token overlap (claim='ASTRAL-3' aact='Comparison of Sofosbuvir/Velpatasvir Fix')
HEPATITIS_HCV_DAA_NMA_REVIEW.html,NCT02642432,EXPEDITION-1,146,OK,A Study to Evaluate the Efficacy and Safety of ABT-493/ABT-530 in Adults With Ch,146,1,1.00,,
HER2_LOW_ADC_NMA_REVIEW.html,NCT03734029,DESTINY-Breast04,557,OK,Trastuzumab Deruxtecan (DS-8201a) Versus Investigator's Choice for HER2-low Brea,557,2,1.00,,
HER2_LOW_ADC_NMA_REVIEW.html,NCT04494425,DESTINY-Breast06,866,OK,Study of Trastuzumab Deruxtecan (T-DXd) vs Investigator's Choice Chemotherapy in,866,2,1.00,,
HER2_LOW_ADC_NMA_REVIEW.html,NCT03901339,TROPiCS-02,543,TITLE_MISMATCH,Study of Sacituzumab Govitecan-hziy Versus Treatment of Physician's Choice in Pa,543,0,1.00,,title 0-token overlap (claim='TROPiCS-02' aact='Study of Sacituzumab Govitecan-hziy Vers')
HER2_LOW_ADC_NMA_REVIEW.html,NCT05374512,TROPION-Breast01,732,OK,A Study of Dato-DXd Versus Investigator's Choice Chemotherapy in Patients With L,644,1,1.14,,
HF_QUADRUPLE_NMA_REVIEW.html,NCT03036124,DAPA-HF,4744,TITLE_MISMATCH,Study to Evaluate the Effect of Dapagliflozin on the Incidence of Worsening Hear,4744,0,1.00,,title 0-token overlap (claim='DAPA-HF' aact='Study to Evaluate the Effect of Dapaglif')
