file,key,claim_name,claim_n,verdict,aact_brief_title,aact_enrollment,title_overlap,n_ratio,country_mismatch,notes
LIPID_HUB_REVIEW.html,NCT02944682,RESPECT-EPA,3884,TITLE_MISMATCH,Household Air Pollution and Health: A Multi-country LPG Intervention Trial,3640,0,1.07,,title 0-token overlap (claim='RESPECT-EPA' aact='Household Air Pollution and Health: A Mu')
LU_PSMA_MCRPC_REVIEW.html,NCT03511664,VISION,831,OK,Study of 177Lu-PSMA-617 In Metastatic Castrate-Resistant Prostate Cancer,861,1,0.97,,
LU_PSMA_MCRPC_REVIEW.html,NCT04689828,PSMAfore,468,OK,177Lu-PSMA-617 vs. Androgen Receptor-Directed Therapy in the Treatment of Progre,469,1,1.00,,
MALARIA_ACT_NMA_REVIEW.html,NCT01704508,Bandim AL-vs-DP,346,TITLE_MISMATCH,Improving Anti-malarial Treatment Options in Guinea-Bissau - Part A,346,0,1.00,,title 0-token overlap (claim='Bandim AL-vs-DP' aact='Improving Anti-malarial Treatment Option')
MALARIA_ACT_NMA_REVIEW.html,NCT06076213,TES2022 DRC,1260,OK,Test Efficacy Study on the Recommended Antimalarial Drugs in the Democratic Repu,1260,1,1.00,,
MALARIA_ACT_NMA_REVIEW.html,NCT04565184,Yaounde TES Cameroon,242,OK,Effectiveness and Safety of Artesunate-Amodiaquine and Artemether-Lumefantrine f,242,2,1.00,,
MALARIA_ACT_NMA_REVIEW.html,NCT05192265,Nigeria PA-vs-AL,172,OK,Efficacy and Safety of Pyronaridine-Artesunate Versus Artemether-Lumefantrine,172,1,1.00,,
MALARIA_ACT_NMA_REVIEW.html,NCT04767191,Siaya-Bungoma TES Kenya,400,OK,Malaria Therapeutic Efficacy Study (TES) Kenya,400,3,1.00,,
MALARIA_VACCINE_NMA_REVIEW.html,NCT00866619,"RTS,S/AS01 Phase 3",8923,TITLE_MISMATCH,Efficacy of GSK Biologicals' Candidate Malaria Vaccine 257049 Against Malaria Di,15459,0,0.58,,"title 0-token overlap (claim='RTS,S/AS01 Phase 3' aact='Efficacy of GSK Biologicals' Candidate M')"
MALARIA_VACCINE_NMA_REVIEW.html,NCT03896724,R21/Matrix-M Phase 2b (Datoo 2021),293,OK,"Safety, Immunogenicity and Efficacy of R21 Matrix-M in 5-17 Month Old Children i",450,1,0.65,,
MALARIA_VACCINE_NMA_REVIEW.html,NCT04704830,R21/Matrix-M Phase 3 (Datoo 2024),4800,COUNTRY_MISMATCH,R21/Matrix-M in African Children Against Clinical Malaria,4800,1,1.00,"India,Burkina Faso,Tanzania,Kenya,Mali","snippet countries not in AACT: India, Burkina Faso, Tanzania, Kenya, Mali"
MALARIA_VACCINES_NMA_REVIEW.html,NCT00866619,"RTS,S Phase 3",11899,TITLE_MISMATCH,Efficacy of GSK Biologicals' Candidate Malaria Vaccine 257049 Against Malaria Di,15459,0,0.77,,"title 0-token overlap (claim='RTS,S Phase 3' aact='Efficacy of GSK Biologicals' Candidate M')"
MALARIA_VACCINES_NMA_REVIEW.html,NCT03896724,R21 Phase 2b,300,TITLE_MISMATCH,"Safety, Immunogenicity and Efficacy of R21 Matrix-M in 5-17 Month Old Children i",450,0,0.67,,"title 0-token overlap (claim='R21 Phase 2b' aact='Safety, Immunogenicity and Efficacy of R')"
MALARIA_VACCINES_NMA_REVIEW.html,NCT04704830,R21 Phase 3,3200,TITLE_MISMATCH+COUNTRY_MISMATCH,R21/Matrix-M in African Children Against Clinical Malaria,4800,0,0.67,"Tanzania,Mali,Burkina Faso,Kenya","title 0-token overlap (claim='R21 Phase 3' aact='R21/Matrix-M in African Children Against'); snippet countries not in AACT: Tanzania, Mali, Burkina Faso, Kenya"
MDR_TB_SHORTENED_NMA_REVIEW.html,NCT02589782,TB-PRACTECAL (BPaLM vs SOC),275,TITLE_MISMATCH,Pragmatic Clinical Trial for a More Effective Concise and Less Toxic MDR-TB Trea,552,0,0.50,,title 0-token overlap (claim='TB-PRACTECAL (BPaLM vs SOC)' aact='Pragmatic Clinical Trial for a More Effe')
MDR_TB_SHORTENED_NMA_REVIEW.html,NCT02333799,Nix-TB (BPaL single-arm XDR-TB),218,TITLE_MISMATCH,A Phase 3 Trial Assessing Safety and Efficacy of B-Pa-L in Participants With DR-,109,0,2.00,,title 0-token overlap (claim='Nix-TB (BPaL single-arm XDR-TB)' aact='A Phase 3 Trial Assessing Safety and Eff')
MDR_TB_SHORTENED_NMA_REVIEW.html,NCT03086486,ZeNix (BPaL dose-finding),184,TITLE_MISMATCH,Various Doses and Durations of Linezolid Plus Bedaquiline & Pretomanid in Partic,181,0,1.02,,title 0-token overlap (claim='ZeNix (BPaL dose-finding)' aact='Various Doses and Durations of Linezolid')
MDRTB_BPAL_REVIEW.html,NCT03086486,ZeNix,91,TITLE_MISMATCH,Various Doses and Durations of Linezolid Plus Bedaquiline & Pretomanid in Partic,181,0,0.50,,title 0-token overlap (claim='ZeNix' aact='Various Doses and Durations of Linezolid')
MDRTB_BPAL_REVIEW.html,NCT02589782,TB-PRACTECAL,275,TITLE_MISMATCH,Pragmatic Clinical Trial for a More Effective Concise and Less Toxic MDR-TB Trea,552,0,0.50,,title 0-token overlap (claim='TB-PRACTECAL' aact='Pragmatic Clinical Trial for a More Effe')
MENTAL_HEALTH_FRIENDSHIP_BENCH_REVIEW.html,LEGACY-PACTR-FRIENDSHIP-BENCH,Friendship Bench Zimbabwe,573,ISRCTN_ONLY,,,,,,non-AACT key
MHEALTH_ART_ADHERENCE_REVIEW.html,NCT00830622,WelTel Kenya 1,536,OK,Cell Phone Intervention to Support Antiretroviral Therapy (ART) Adherence in Ken,536,1,1.00,,
MIGRAINE_ACUTE_NMA_REVIEW.html,NCT03461757,ACHIEVE I,854,TITLE_MISMATCH,Trial in Adult Subjects With Acute Migraines,1811,0,0.47,,title 0-token overlap (claim='ACHIEVE I' aact='Trial in Adult Subjects With Acute Migra')
MIGRAINE_ACUTE_NMA_REVIEW.html,NCT03235479,ACHIEVE II,920,TITLE_MISMATCH,Safety and Efficacy Study in Adult Subjects With Acute Migraines,1485,0,0.62,,title 0-token overlap (claim='ACHIEVE II' aact='Safety and Efficacy Study in Adult Subje')
MIGRAINE_ACUTE_NMA_REVIEW.html,NCT02867709,SAMURAI,1158,TITLE_MISMATCH,"Efficacy, Safety, and Tolerability of Oral Ubrogepant in the Acute Treatment of ",1686,0,0.69,,"title 0-token overlap (claim='SAMURAI' aact='Efficacy, Safety, and Tolerability of Or')"
MIGRAINE_ACUTE_NMA_REVIEW.html,NCT03872453,Rimegepant Study 303,1084,TITLE_MISMATCH,Acute Treatment Trial in Adult Subjects With Migraines,2154,0,0.50,,title 0-token overlap (claim='Rimegepant Study 303' aact='Acute Treatment Trial in Adult Subjects ')
MIRIKIZUMAB_UC_REVIEW.html,NCT03518086,LUCENT-1,1162,OK,An Induction Study of Mirikizumab in Participants With Moderately to Severely Ac,1281,1,0.91,,
MIRIKIZUMAB_UC_REVIEW.html,NCT03524092,LUCENT-2,544,OK,A Maintenance Study of Mirikizumab in Participants With Moderately to Severely A,1177,1,0.46,,
MIRVETUXIMAB_OVARIAN_REVIEW.html,NCT04209855,MIRASOL,453,OK,A Study of Mirvetuximab Soravtansine vs. Investigator's Choice (IC) of Chemother,453,1,1.00,,
MITAPIVAT_THALASSEMIA_REVIEW.html,NCT04770753,ENERGIZE,194,OK,A Study Evaluating the Efficacy and Safety of Mitapivat in Participants With Non,194,1,1.00,,
MITRAL_FUNCMR_REVIEW.html,NCT01626079,COAPT,614,OK,Cardiovascular Outcomes Assessment of the MitraClip Percutaneous Therapy for Hea,776,1,0.79,,
MITRAL_FUNCMR_REVIEW.html,NCT01920698,MITRA-FR,307,TITLE_MISMATCH,Multicentre Study of Percutaneous Mitral Valve Repair MitraClip Device in Patien,304,0,1.01,,title 0-token overlap (claim='MITRA-FR' aact='Multicentre Study of Percutaneous Mitral')
MITRAL_FUNCMR_REVIEW.html,NCT02444338,RESHAPE-HF2,505,TITLE_MISMATCH,A Clinical Evaluation of the Safety and Effectiveness of the MitraClip System in,505,0,1.00,,title 0-token overlap (claim='RESHAPE-HF2' aact='A Clinical Evaluation of the Safety and ')
MM_1L_NMA_REVIEW.html,NCT02252172,MAIA,737,TITLE_MISMATCH,"Study Comparing Daratumumab, Lenalidomide, and Dexamethasone With Lenalidomide a",737,0,1.00,,"title 0-token overlap (claim='MAIA' aact='Study Comparing Daratumumab, Lenalidomid')"
MM_1L_NMA_REVIEW.html,NCT02195479,ALCYONE,706,TITLE_MISMATCH,A Study of Combination of Daratumumab and Velcade (Bortezomib) Melphalan-Prednis,706,0,1.00,,title 0-token overlap (claim='ALCYONE' aact='A Study of Combination of Daratumumab an')
MM_1L_NMA_REVIEW.html,NCT02541383,CASSIOPEIA,1085,TITLE_MISMATCH,A Study to Evaluate Daratumumab in Transplant Eligible Participants With Previou,1085,0,1.00,,title 0-token overlap (claim='CASSIOPEIA' aact='A Study to Evaluate Daratumumab in Trans')
MM_1L_NMA_REVIEW.html,NCT03319667,IMROZ,530,TITLE_MISMATCH,A Study to Investigate the Clinical Benefit of Isatuximab in Combination With Bo,475,0,1.12,,title 0-token overlap (claim='IMROZ' aact='A Study to Investigate the Clinical Bene')
NEOADJUVANT_IO_NSCLC_REVIEW.html,NCT02998528,CheckMate-816,358,TITLE_MISMATCH,A Neoadjuvant Study of Nivolumab Plus Ipilimumab or Nivolumab Plus Chemotherapy ,505,0,0.71,,title 0-token overlap (claim='CheckMate-816' aact='A Neoadjuvant Study of Nivolumab Plus Ip')
NEOADJUVANT_IO_NSCLC_REVIEW.html,NCT03425643,KEYNOTE-671,797,OK,Efficacy and Safety of Pembrolizumab (MK-3475) With Platinum Doublet Chemotherap,797,1,1.00,,
NEOADJUVANT_IO_NSCLC_REVIEW.html,NCT03800134,AEGEAN,802,OK,A Study of Neoadjuvant/Adjuvant Durvalumab for the Treatment of Patients With Re,825,1,0.97,,
NIRSEVIMAB_INFANT_RSV_REVIEW.html,NCT02878330,Nirsevimab Phase 2b,1453,TITLE_MISMATCH,A Study to Evaluate the Safety and Efficacy of MEDI8897 for the Prevention of Me,1453,0,1.00,,title 0-token overlap (claim='Nirsevimab Phase 2b' aact='A Study to Evaluate the Safety and Effic')
NIRSEVIMAB_INFANT_RSV_REVIEW.html,NCT03979313,MELODY,1490,OK,A Study to Evaluate the Safety and Efficacy of MEDI8897 for the Prevention of Me,3012,1,0.49,,
NIRSEVIMAB_INFANT_RSV_REVIEW.html,NCT05437510,HARMONIE,8058,OK,Study of a Single Intramuscular Dose of Nirsevimab in the Prevention of Hospital,8057,1,1.00,,
OBESITY_DRUGS_NMA_REVIEW.html,NCT04184622,SURMOUNT-1,3162,OK,A Study of Tirzepatide (LY3298176) in Participants With Obesity or Overweight,2539,1,1.25,,
OBESITY_DRUGS_NMA_REVIEW.html,NCT03548935,STEP 1,1961,OK,STEP 1: Research Study Investigating How Well Semaglutide Works in People Suffer,1961,1,1.00,,
OBESITY_DRUGS_NMA_REVIEW.html,NCT01272219,SCALE Obesity,3731,OK,Effect of Liraglutide on Body Weight in Non-diabetic Obese Subjects or Overweigh,3731,2,1.00,,
OSIMERTINIB_EGFR_NSCLC_REVIEW.html,NCT02151981,AURA3,419,OK,AZD9291 (Osimertinib) Versus Platinum-Based Doublet-Chemotherapy in Locally Adva,421,1,1.00,,
OSIMERTINIB_EGFR_NSCLC_REVIEW.html,NCT02296125,FLAURA,556,TITLE_MISMATCH,AZD9291 Versus Gefitinib or Erlotinib in Patients With Locally Advanced or Metas,674,0,0.82,,title 0-token overlap (claim='FLAURA' aact='AZD9291 Versus Gefitinib or Erlotinib in')
OSIMERTINIB_EGFR_NSCLC_REVIEW.html,NCT02511106,ADAURA,682,OK,AZD9291 Versus Placebo in Patients With Stage IB-IIIA Non-small Cell Lung Carcin,682,1,1.00,,
OSIMERTINIB_EGFR_NSCLC_REVIEW.html,NCT04035486,FLAURA2,557,OK,A Study of Osimertinib With or Without Chemotherapy as 1st Line Treatment in Pat,587,1,0.95,,
PAH_THERAPY_NMA_REVIEW.html,NCT04576988,STELLAR,323,OK,A Study of Sotatercept for the Treatment of Pulmonary Arterial Hypertension (MK-,324,1,1.00,,
PAH_THERAPY_NMA_REVIEW.html,NCT01106014,GRIPHON,1156,TITLE_MISMATCH,Selexipag (ACT-293987) in Pulmonary Arterial Hypertension,1156,0,1.00,,title 0-token overlap (claim='GRIPHON' aact='Selexipag (ACT-293987) in Pulmonary Arte')
PAH_THERAPY_NMA_REVIEW.html,NCT00810693,PATENT-1,380,TITLE_MISMATCH,A Study to Evaluate Efficacy and Safety of Oral BAY63-2521 in Patients With Pulm,445,0,0.85,,title 0-token overlap (claim='PATENT-1' aact='A Study to Evaluate Efficacy and Safety ')
PAH_THERAPY_NMA_REVIEW.html,NCT00660179,SERAPHIN,492,TITLE_MISMATCH,Study of Macitentan (ACT-064992) on Morbidity and Mortality in Patients With Sym,742,0,0.66,,title 0-token overlap (claim='SERAPHIN' aact='Study of Macitentan (ACT-064992) on Morb')
PARP_ARPI_MCRPC_REVIEW.html,NCT03732820,PROpel,796,OK,Study on Olaparib Plus Abiraterone as First-line Therapy in Men With Metastatic ,895,1,0.89,,
PARP_ARPI_MCRPC_REVIEW.html,NCT03748641,MAGNITUDE,423,TITLE_MISMATCH,A Study of Niraparib in Combination With Abiraterone Acetate and Prednisone Vers,765,0,0.55,,title 0-token overlap (claim='MAGNITUDE' aact='A Study of Niraparib in Combination With')
PARP_ARPI_MCRPC_REVIEW.html,NCT03395197,TALAPRO-2,805,TITLE_MISMATCH,Talazoparib + Enzalutamide vs. Enzalutamide Monotherapy in mCRPC,1054,0,0.76,,title 0-token overlap (claim='TALAPRO-2' aact='Talazoparib + Enzalutamide vs. Enzalutam')
PARP_OVARIAN_REVIEW.html,NCT01844986,SOLO-1,391,TITLE_MISMATCH,Olaparib Maintenance Monotherapy in Patients With BRCA Mutated Ovarian Cancer Fo,450,0,0.87,,title 0-token overlap (claim='SOLO-1' aact='Olaparib Maintenance Monotherapy in Pati')
PARP_OVARIAN_REVIEW.html,NCT02477644,PAOLA-1,806,TITLE_MISMATCH,"Platine, Avastin and OLAparib in 1st Line",806,0,1.00,,"title 0-token overlap (claim='PAOLA-1' aact='Platine, Avastin and OLAparib in 1st Lin')"
PARP_OVARIAN_REVIEW.html,NCT02655016,PRIMA,733,TITLE_MISMATCH,A Study of Niraparib (GSK3985771) Maintenance Treatment in Participants With Adv,733,0,1.00,,title 0-token overlap (claim='PRIMA' aact='A Study of Niraparib (GSK3985771) Mainte')
PBC_PPAR_REVIEW.html,NCT04526665,ELATIVE,161,TITLE_MISMATCH,Study of Elafibranor in Patients With Primary Biliary Cholangitis (PBC),161,0,1.00,,title 0-token overlap (claim='ELATIVE' aact='Study of Elafibranor in Patients With Pr')
PBC_PPAR_REVIEW.html,NCT04620733,RESPONSE,193,OK,RESPONSE: Response to Seladelpar in Subjects With Primary Biliary Cholangitis (P,193,1,1.00,,
PCSK9_LIPID_NMA_REVIEW.html,NCT00202878,IMPROVE-IT,18144,OK,IMPROVE-IT: Examining Outcomes in Subjects With Acute Coronary Syndrome: Vytorin,18144,1,1.00,,
PCSK9_LIPID_NMA_REVIEW.html,NCT01764633,FOURIER,27564,TITLE_MISMATCH,Further Cardiovascular Outcomes Research With PCSK9 Inhibition in Subjects With ,27564,0,1.00,,title 0-token overlap (claim='FOURIER' aact='Further Cardiovascular Outcomes Research')
PCSK9_LIPID_NMA_REVIEW.html,NCT01663402,ODYSSEY-OUTCOMES,18924,OK,ODYSSEY Outcomes: Evaluation of Cardiovascular Outcomes After an Acute Coronary ,18924,2,1.00,,
PCSK9_LIPID_NMA_REVIEW.html,NCT02993406,CLEAR-OUTCOMES,13970,TITLE_MISMATCH,"Evaluation of Major Cardiovascular Events in Participants With, or at High Risk ",13970,0,1.00,,title 0-token overlap (claim='CLEAR-OUTCOMES' aact='Evaluation of Major Cardiovascular Event')
PEDIATRIC_HIV_ART_NMA_REVIEW.html,NCT02259127,"ODYSSEY (DTG vs SOC, paeds)",707,OK,ODYSSEY (PENTA 20),792,1,0.89,,
PEDIATRIC_HIV_ART_NMA_REVIEW.html,LEGACY-ISRCTN-69078957-CHAPAS-3,CHAPAS-3 (NRTI backbone in paeds),317,ISRCTN_ONLY,,,,,,non-AACT key
PEDIATRIC_HIV_ART_NMA_REVIEW.html,LEGACY-ISRCTN-24791884-ARROW,ARROW (clinical vs lab monitoring),798,ISRCTN_ONLY,,,,,,non-AACT key
PI3K_AKT_BC_REVIEW.html,NCT02437318,SOLAR-1,341,TITLE_MISMATCH,Study Assessing the Efficacy and Safety of Alpelisib Plus Fulvestrant in Men and,572,0,0.60,,title 0-token overlap (claim='SOLAR-1' aact='Study Assessing the Efficacy and Safety ')
PI3K_AKT_BC_REVIEW.html,NCT04305496,CAPItello-291,708,TITLE_MISMATCH,Capivasertib+Fulvestrant vs Placebo+Fulvestrant as Treatment for Locally Advance,818,0,0.87,,title 0-token overlap (claim='CAPItello-291' aact='Capivasertib+Fulvestrant vs Placebo+Fulv')
PI3K_AKT_BC_REVIEW.html,NCT04191499,INAVO120,325,TITLE_MISMATCH,A Study Evaluating the Efficacy and Safety of Inavolisib + Palbociclib + Fulvest,325,0,1.00,,title 0-token overlap (claim='INAVO120' aact='A Study Evaluating the Efficacy and Safe')
PNEUMONIA_AMOXICILLIN_DURATION_REVIEW.html,LEGACY-ISRCTN-76888927-CAP-IT,CAP-IT (Bielicki 2021),814,ISRCTN_ONLY,,,,,,non-AACT key
POSTPARTUM_HEMORRHAGE_NMA_REVIEW.html,NCT04341662,E-MOTIVE (PPH bundle),99659,OK,A Clinical Trial to Study the Effectiveness of a Care Bundle to Prevent Bleeding,99659,2,1.00,,
POSTPARTUM_HEMORRHAGE_NMA_REVIEW.html,LEGACY-ISRCTN-76912190-WOMAN,WOMAN trial (TXA for PPH),20021,ISRCTN_ONLY,,,,,,non-AACT key
POSTPARTUM_HEMORRHAGE_NMA_REVIEW.html,LEGACY-ISRCTN-95444399-CHAMPION,CHAMPION (heat-stable carbetocin),29065,ISRCTN_ONLY,,,,,,non-AACT key
PPH_BUNDLE_NMA_REVIEW.html,NCT00872469,WOMAN,20021,TITLE_MISMATCH,World Maternal Antifibrinolytic Trial,20060,0,1.00,,title 0-token overlap (claim='WOMAN' aact='World Maternal Antifibrinolytic Trial')
PPH_BUNDLE_NMA_REVIEW.html,NCT03475342,WOMAN-2,8403,TITLE_MISMATCH,World Maternal Antifibrinolytic Trial_2,15068,0,0.56,,title 0-token overlap (claim='WOMAN-2' aact='World Maternal Antifibrinolytic Trial_2')
PPH_BUNDLE_NMA_REVIEW.html,NCT04341662,E-MOTIVE,105423,OK,A Clinical Trial to Study the Effectiveness of a Care Bundle to Prevent Bleeding,99659,1,1.06,,
PREGNANCY_HIV_VESTED_REVIEW.html,NCT03048422,IMPAACT 2010 / VESTED,643,TITLE_MISMATCH,Evaluating the Efficacy and Safety of Dolutegravir-Containing Versus Efavirenz-C,643,0,1.00,,title 0-token overlap (claim='IMPAACT 2010 / VESTED' aact='Evaluating the Efficacy and Safety of Do')
PREGNANCY_IRON_FCM_REVIEW.html,LEGACY-ANZCTR-12618001268235-FCM,Pasricha 2023 Malawi (FCM vs oral iron),674,ISRCTN_ONLY,,,,,,non-AACT key
PRIMAQUINE_GAMETOCYTE_DR_REVIEW.html,NCT01365598,Eziefula 2014 Uganda,232,OK,Evaluation of the Gametocytocidal Efficacy and Safety of Primaquine in Uncomplic,468,1,0.50,,
PSA_BIOLOGICS_NMA_REVIEW.html,NCT01695239,SPIRIT-P1,213,TITLE_MISMATCH,A Study of Ixekizumab in Participants With Active Psoriatic Arthritis,417,0,0.51,,title 0-token overlap (claim='SPIRIT-P1' aact='A Study of Ixekizumab in Participants Wi')
PSA_BIOLOGICS_NMA_REVIEW.html,NCT03158285,DISCOVER-2,491,TITLE_MISMATCH,A Study Evaluating the Efficacy and Safety of Guselkumab Administered Subcutaneo,741,0,0.66,,title 0-token overlap (claim='DISCOVER-2' aact='A Study Evaluating the Efficacy and Safe')
PSA_BIOLOGICS_NMA_REVIEW.html,NCT03895203,BE OPTIMAL,712,TITLE_MISMATCH,A Study to Test the Efficacy and Safety of Bimekizumab in the Treatment of Subje,852,0,0.84,,title 0-token overlap (claim='BE OPTIMAL' aact='A Study to Test the Efficacy and Safety ')
PSA_BIOLOGICS_NMA_REVIEW.html,NCT03104400,SELECT-PsA 1,848,OK,A Study Comparing Upadacitinib (ABT-494) to Placebo and to Adalimumab in Partici,1705,1,0.50,,
RCC_1L_NMA_REVIEW.html,NCT03141177,CheckMate 9ER,651,TITLE_MISMATCH,A Study of Nivolumab Combined With Cabozantinib Compared to Sunitinib in Previou,701,0,0.93,,title 0-token overlap (claim='CheckMate 9ER' aact='A Study of Nivolumab Combined With Caboz')
RCC_1L_NMA_REVIEW.html,NCT02853331,KEYNOTE-426,861,OK,Study to Evaluate the Efficacy and Safety of Pembrolizumab (MK-3475) in Combinat,861,1,1.00,,
RCC_1L_NMA_REVIEW.html,NCT02811861,CLEAR,712,OK,Lenvatinib/Everolimus or Lenvatinib/Pembrolizumab Versus Sunitinib Alone as Trea,1069,1,0.67,,
RCC_1L_NMA_REVIEW.html,NCT02231749,CheckMate 214,847,OK,Nivolumab Combined With Ipilimumab Versus Sunitinib in Previously Untreated Adva,1390,1,0.61,,
RESMETIROM_MASH_REVIEW.html,NCT03900429,MAESTRO-NASH,644,OK,A Phase 3 Study to Evaluate the Efficacy and Safety of MGL-3196 (Resmetirom) in ,1759,1,0.37,,
RISANKIZUMAB_CD_REVIEW.html,NCT03105128,ADVANCE,511,TITLE_MISMATCH,A Study of the Efficacy and Safety of Risankizumab in Participants With Moderate,931,0,0.55,,title 0-token overlap (claim='ADVANCE' aact='A Study of the Efficacy and Safety of Ri')
RISANKIZUMAB_CD_REVIEW.html,NCT03104413,MOTIVATE,412,TITLE_MISMATCH,A Study to Assess the Efficacy and Safety of Risankizumab in Participants With M,618,0,0.67,,title 0-token overlap (claim='MOTIVATE' aact='A Study to Assess the Efficacy and Safet')
RISANKIZUMAB_CD_REVIEW.html,NCT03105102,FORTIFY,305,TITLE_MISMATCH,A Study of the Efficacy and Safety of Risankizumab in Participants With Crohn's ,1336,0,0.23,,title 0-token overlap (claim='FORTIFY' aact='A Study of the Efficacy and Safety of Ri')
ROMOSOZUMAB_OP_REVIEW.html,NCT01575834,FRAME,7180,TITLE_MISMATCH,Efficacy and Safety of Romosozumab Treatment in Postmenopausal Women With Osteop,7180,0,1.00,,title 0-token overlap (claim='FRAME' aact='Efficacy and Safety of Romosozumab Treat')
ROMOSOZUMAB_OP_REVIEW.html,NCT01631214,ARCH,4093,TITLE_MISMATCH,Study to Determine the Efficacy and Safety of Romosozumab in the Treatment of Po,4093,0,1.00,,title 0-token overlap (claim='ARCH' aact='Study to Determine the Efficacy and Safe')
ROMOSOZUMAB_OP_REVIEW.html,NCT02186171,BRIDGE,245,TITLE_MISMATCH,A Study to Compare the Safety and Efficacy of Romosozumab (AMG 785) Versus Place,245,0,1.00,,title 0-token overlap (claim='BRIDGE' aact='A Study to Compare the Safety and Effica')
ROTAVIRUS_VACCINE_AFRICA_NMA_REVIEW.html,NCT00241644,Rotarix Africa (Madhi 2010),2089,TITLE_MISMATCH,Vaccine Efficacy Against Rotavirus Diarrhea; Vaccine Given With Routine Childhoo,2089,0,1.00,,title 0-token overlap (claim='Rotarix Africa (Madhi 2010)' aact='Vaccine Efficacy Against Rotavirus Diarr')
ROTAVIRUS_VACCINE_AFRICA_NMA_REVIEW.html,NCT00362648,RotaTeq Africa (Armah 2010),5468,COUNTRY_MISMATCH,Developing World Study for RotaTeq™ (V260-015)(COMPLETED),7504,2,0.73,"Ghana,Bangladesh,Kenya,Mali,Vietnam","snippet countries not in AACT: Ghana, Bangladesh, Kenya, Mali, Vietnam"
ROTAVIRUS_VACCINE_AFRICA_NMA_REVIEW.html,NCT02145000,Rotasiil ROSE Niger (Isanaka 2017),4413,COUNTRY_MISMATCH,Efficacy and Safety of a Pentavalent Rotavirus Vaccine (BRV-PV) Against Severe R,6586,1,0.67,India,snippet countries not in AACT: India
RSV_VACCINE_OLDER_REVIEW.html,NCT05035212,RENOIR,34284,TITLE_MISMATCH,"Study to Evaluate the Efficacy, Immunogenicity, and Safety of RSVpreF in Adults.",38861,0,0.88,,"title 0-token overlap (claim='RENOIR' aact='Study to Evaluate the Efficacy, Immunoge')"
RSV_VACCINE_OLDER_REVIEW.html,NCT04886596,AReSVi-006,24960,TITLE_MISMATCH,Efficacy Study of GSK's Investigational Respiratory Syncytial Virus (RSV) Vaccin,26675,0,0.94,,title 0-token overlap (claim='AReSVi-006' aact='Efficacy Study of GSK's Investigational ')
RSV_VACCINE_OLDER_REVIEW.html,NCT05127434,ConquerRSV,35088,TITLE_MISMATCH,A Study to Evaluate the Safety and Efficacy of mRNA-1345 Vaccine Targeting Respi,36814,0,0.95,,title 0-token overlap (claim='ConquerRSV' aact='A Study to Evaluate the Safety and Effic')
RUSFERTIDE_PV_REVIEW.html,NCT05210790,VERIFY,293,TITLE_MISMATCH,A Phase 3 Study of Rusfertide in Patients With Polycythemia Vera,293,0,1.00,,title 0-token overlap (claim='VERIFY' aact='A Phase 3 Study of Rusfertide in Patient')
SAM_SIMPLIFIED_PROTOCOL_REVIEW.html,NCT04698070,OptiMA Niger (ComPAS vs Standard),1153,OK,Optimizing Acute Malnutrition Management in Children Aged 6 to 59 Months in Nige,2304,2,0.50,,
SCD_DISEASE_MOD_NMA_REVIEW.html,NCT01179217,L-glutamine (Endari),230,OK,A Phase III Safety and Efficacy Study of L-Glutamine to Treat Sickle Cell Diseas,230,1,1.00,,
SCHISTOSOMIASIS_ARPRAZIQUANTEL_REVIEW.html,NCT03845140,L-PZQ ODT (arpraziquantel) phase 3,145,TITLE_MISMATCH,L-PZQ ODT in Schistosoma Infected Children,288,0,0.50,,title 0-token overlap (claim='L-PZQ ODT (arpraziquantel) phase 3' aact='L-PZQ ODT in Schistosoma Infected Childr')
SEMAGLUTIDE_OBESITY_REVIEW.html,NCT03552757,STEP-2,807,TITLE_MISMATCH,Research Study Investigating How Well Semaglutide Works in People With Type 2 Di,1210,0,0.67,,title 0-token overlap (claim='STEP-2' aact='Research Study Investigating How Well Se')
SEVERE_ASTHMA_NMA_REVIEW.html,NCT01691521,MENSA,385,TITLE_MISMATCH,Efficacy and Safety Study of Mepolizumab Adjunctive Therapy in Subjects With Sev,580,0,0.66,,title 0-token overlap (claim='MENSA' aact='Efficacy and Safety Study of Mepolizumab')
SEVERE_ASTHMA_NMA_REVIEW.html,NCT01287039,Castro-2015-Resliz,941,TITLE_MISMATCH,A Study to Evaluate the Efficacy and Safety of Reslizumab (3.0 mg/kg) in the Red,489,0,1.92,,title 0-token overlap (claim='Castro-2015-Resliz' aact='A Study to Evaluate the Efficacy and Saf')
SEVERE_ASTHMA_NMA_REVIEW.html,NCT01928771,SIROCCO,805,TITLE_MISMATCH,Efficacy and Safety Study of Benralizumab Added to High-dose Inhaled Corticoster,2681,0,0.30,,title 0-token overlap (claim='SIROCCO' aact='Efficacy and Safety Study of Benralizuma')
SEVERE_ASTHMA_NMA_REVIEW.html,NCT02414854,QUEST,948,OK,Evaluation of Dupilumab in Patients With Persistent Asthma (Liberty Asthma Quest,1902,1,0.50,,
SEVERE_ASTHMA_NMA_REVIEW.html,NCT03347279,NAVIGATOR,1059,OK,Study to Evaluate Tezepelumab in Adults & Adolescents With Severe Uncontrolled A,1061,1,1.00,,
SEVERE_PEDIATRIC_FEBRILE_AFRICA_NMA_REVIEW.html,LEGACY-ISRCTN-50258054-AQUAMAT,AQUAMAT (IV artesunate vs IV quinine),5425,ISRCTN_ONLY,,,,,,non-AACT key
SEVERE_PEDIATRIC_FEBRILE_AFRICA_NMA_REVIEW.html,LEGACY-ISRCTN-69856593-FEAST,FEAST (fluid bolus severe sepsis),3141,ISRCTN_ONLY,,,,,,non-AACT key
SEVERE_PEDIATRIC_FEBRILE_AFRICA_NMA_REVIEW.html,LEGACY-ISRCTN-84086586-TRACT,TRACT (transfusion threshold anaemic),3196,ISRCTN_ONLY,,,,,,non-AACT key
SGLT2_HF_REVIEW.html,NCT03036124,DAPA-HF,4744,TITLE_MISMATCH,Study to Evaluate the Effect of Dapagliflozin on the Incidence of Worsening Hear,4744,0,1.00,,title 0-token overlap (claim='DAPA-HF' aact='Study to Evaluate the Effect of Dapaglif')
SGLT2_HF_REVIEW.html,NCT03057977,EMPEROR-Reduced,3730,OK,EMPagliflozin outcomE tRial in Patients With chrOnic heaRt Failure With Reduced ,3730,2,1.00,,
SGLT2_HF_REVIEW.html,NCT03057951,EMPEROR-Preserved,5988,OK,EMPagliflozin outcomE tRial in Patients With chrOnic heaRt Failure With Preserve,5988,2,1.00,,
SGLT2_HF_REVIEW.html,NCT03619213,DELIVER,6263,TITLE_MISMATCH,Dapagliflozin Evaluation to Improve the LIVEs of Patients With PReserved Ejectio,6263,0,1.00,,title 0-token overlap (claim='DELIVER' aact='Dapagliflozin Evaluation to Improve the ')
SGLT2_HF_REVIEW.html,NCT03521934,SOLOIST-WHF,1222,OK,Effect of Sotagliflozin on Cardiovascular Events in Participants With Type 2 Dia,1222,1,1.00,,
SGLT2_MACE_CVOT_REVIEW.html,NCT01131676,EMPA-REG OUTCOME,7020,OK,BI 10773 (Empagliflozin) Cardiovascular Outcome Event Trial in Type 2 Diabetes M,7064,2,0.99,,
SGLT2_MACE_CVOT_REVIEW.html,NCT01032629,CANVAS,10142,N_OUTLIER,CANVAS - CANagliflozin cardioVascular Assessment Study,4330,1,2.34,,row 10142 vs aact 4330 ratio 2.34
SGLT2_MACE_CVOT_REVIEW.html,NCT01730534,DECLARE-TIMI 58,17160,TITLE_MISMATCH,Multicenter Trial to Evaluate the Effect of Dapagliflozin on the Incidence of Ca,17190,0,1.00,,title 0-token overlap (claim='DECLARE-TIMI 58' aact='Multicenter Trial to Evaluate the Effect')
SGLT2_MACE_CVOT_REVIEW.html,NCT01986881,VERTIS-CV,8240,OK,Cardiovascular Outcomes Following Ertugliflozin Treatment in Type 2 Diabetes Mel,8246,1,1.00,,
