file,nct,pmid,claimed_name,claimed_year,status,esummary_title,esummary_year,suggested_pmid,suggested_title,suggested_query,status_v3,new_pmid,new_title,reason
SCHISTOSOMIASIS_ARPRAZIQUANTEL_REVIEW.html,NCT03845140,38678933,L-PZQ ODT (arpraziquantel) phase 3,,WRONG_PMID,Quorum sensing bacteria improve microbial networks stability and complexity in wastewater treatment plants.,2024 May,36893784,,NCT03845140[si],WRONG_PMID,36893784,"Efficacy, safety, and palatability of arpraziquantel (L-praziquantel) orodispersible tablets in children aged 3 months to 6 years infected with Schistosoma in Côte d'Ivoire and Kenya: an open-label, partly randomised, phase 3 trial.",score=2
TB_PREVENTION_REVIEW.html,NCT01404312,30855125,BRIEF-TB / A5279,,WRONG_PMID,3D Bioprinted Scaffolds Containing Viable Macrophages and Antibiotics Promote Clearance of Staphylococcus aureus Craniotomy-Associated Biofilm Infection.,2019 Apr 3,35943252,Population Pharmacokinetic Modeling and Simulation of Rifapentine Supports Concomitant Antiretroviral Therapy with Efavirenz and Non-Weight Based Dosing.,NCT01404312[si],WRONG_PMID,26082504,Efavirenz Pharmacokinetics and Pharmacodynamics in HIV-Infected Persons Receiving Rifapentine and Isoniazid for Tuberculosis Prevention.,score=2.5
VENETOCLAX_CLL_REVIEW.html,NCT02242942,31141626,CLL14,,WRONG_PMID,Five-Year Follow-up after Face Transplantation.,2019 Jun 27,40944848,Indirect Comparisons of the Efficacy and Safety of Zanubrutinib versus Venetoclax plus Obinutuzumab in Treatment-Naïve Chronic Lymphocytic Leukemia/Small Lymphocytic Lymphoma.,NCT02242942[si],WRONG_PMID,32888452,"Venetoclax plus obinutuzumab versus chlorambucil plus obinutuzumab for previously untreated chronic lymphocytic leukaemia (CLL14): follow-up results from a multicentre, open-label, randomised, phase 3 trial.",score=3.5
VUTRISIRAN_ATTR_REVIEW.html,NCT04153149,39213189,HELIOS-B,,WRONG_PMID,Parkin activates innate immunity and promotes antitumor immune responses.,2024 Aug 30,41225306,Timing of Mortality Benefit in Outcomes Trials in Transthyretin Amyloidosis.,NCT04153149[si],WRONG_PMID,40770082,Effects of vutrisiran on cardiac structure and function in patients with transthyretin amyloidosis with cardiomyopathy: secondary outcomes of the HELIOS-B trial.,score=2
ZURANOLONE_PPD_REVIEW.html,NCT04442503,37551612,SKYLARK,,WRONG_PMID,Prognostic Relevance of Primary Tumor Sidedness in Early-stage Colorectal Cancer: An Integrated Analysis of 4 Randomized Controlled Trials (JCOG2003A).,2024 Feb 1,37491938,Zuranolone for the Treatment of Postpartum Depression.,NCT04442503[si],WRONG_PMID,37491938,Zuranolone for the Treatment of Postpartum Depression.,score=4
